============================= test session starts ==============================
platform darwin -- Python 3.9.6, pytest-8.4.2, pluggy-1.6.0 -- /Library/Developer/CommandLineTools/usr/bin/python3
cachedir: .pytest_cache
rootdir: /Users/silasmarkowicz/trading-ai-working
configfile: pytest.ini
plugins: anyio-4.12.1, mock-3.15.1, cov-6.3.0, asyncio-0.26.0
asyncio: mode=strict, asyncio_default_fixture_loop_scope=None, asyncio_default_test_loop_scope=function
collecting ... collected 67 items / 6 errors

==================================== ERRORS ====================================
______________ ERROR collecting tests/test_advanced_strategies.py ______________
ImportError while importing test module '/Users/silasmarkowicz/trading-ai-working/tests/test_advanced_strategies.py'.
Hint: make sure your test modules/packages have valid Python names.
Traceback:
../Library/Python/3.9/lib/python/site-packages/_pytest/python.py:498: in importtestmodule
    mod = import_path(
../Library/Python/3.9/lib/python/site-packages/_pytest/pathlib.py:587: in import_path
    importlib.import_module(module_name)
/Library/Developer/CommandLineTools/Library/Frameworks/Python3.framework/Versions/3.9/lib/python3.9/importlib/__init__.py:127: in import_module
    return _bootstrap._gcd_import(name[level:], package, level)
<frozen importlib._bootstrap>:1030: in _gcd_import
    ???
<frozen importlib._bootstrap>:1007: in _find_and_load
    ???
<frozen importlib._bootstrap>:986: in _find_and_load_unlocked
    ???
<frozen importlib._bootstrap>:680: in _load_unlocked
    ???
../Library/Python/3.9/lib/python/site-packages/_pytest/assertion/rewrite.py:186: in exec_module
    exec(co, module.__dict__)
tests/test_advanced_strategies.py:12: in <module>
    from advanced_strategies.portfolio_optimizer import PortfolioOptimizer
src/advanced_strategies/__init__.py:17: in <module>
    from .multi_timeframe import MultiTimeframeAnalyzer
src/advanced_strategies/multi_timeframe.py:18: in <module>
    from ..feature_engineering.feature_generator import FeatureGenerator
E   ImportError: attempted relative import beyond top-level package
______________ ERROR collecting tests/test_broker_integration.py _______________
ImportError while importing test module '/Users/silasmarkowicz/trading-ai-working/tests/test_broker_integration.py'.
Hint: make sure your test modules/packages have valid Python names.
Traceback:
../Library/Python/3.9/lib/python/site-packages/_pytest/python.py:498: in importtestmodule
    mod = import_path(
../Library/Python/3.9/lib/python/site-packages/_pytest/pathlib.py:587: in import_path
    importlib.import_module(module_name)
/Library/Developer/CommandLineTools/Library/Frameworks/Python3.framework/Versions/3.9/lib/python3.9/importlib/__init__.py:127: in import_module
    return _bootstrap._gcd_import(name[level:], package, level)
<frozen importlib._bootstrap>:1030: in _gcd_import
    ???
<frozen importlib._bootstrap>:1007: in _find_and_load
    ???
<frozen importlib._bootstrap>:986: in _find_and_load_unlocked
    ???
<frozen importlib._bootstrap>:680: in _load_unlocked
    ???
../Library/Python/3.9/lib/python/site-packages/_pytest/assertion/rewrite.py:186: in exec_module
    exec(co, module.__dict__)
tests/test_broker_integration.py:16: in <module>
    from execution.broker_interface import BrokerInterface, OrderType, OrderSide
src/execution/broker_interface.py:16: in <module>
    from ..utils.logger import setup_logger
E   ImportError: attempted relative import beyond top-level package
___________________ ERROR collecting tests/test_exchanges.py ___________________
ImportError while importing test module '/Users/silasmarkowicz/trading-ai-working/tests/test_exchanges.py'.
Hint: make sure your test modules/packages have valid Python names.
Traceback:
../Library/Python/3.9/lib/python/site-packages/_pytest/python.py:498: in importtestmodule
    mod = import_path(
../Library/Python/3.9/lib/python/site-packages/_pytest/pathlib.py:587: in import_path
    importlib.import_module(module_name)
/Library/Developer/CommandLineTools/Library/Frameworks/Python3.framework/Versions/3.9/lib/python3.9/importlib/__init__.py:127: in import_module
    return _bootstrap._gcd_import(name[level:], package, level)
<frozen importlib._bootstrap>:1030: in _gcd_import
    ???
<frozen importlib._bootstrap>:1007: in _find_and_load
    ???
<frozen importlib._bootstrap>:986: in _find_and_load_unlocked
    ???
<frozen importlib._bootstrap>:680: in _load_unlocked
    ???
../Library/Python/3.9/lib/python/site-packages/_pytest/assertion/rewrite.py:186: in exec_module
    exec(co, module.__dict__)
tests/test_exchanges.py:14: in <module>
    from exchanges.coinbase_client import CoinbaseClient
E   ImportError: cannot import name 'CoinbaseClient' from 'exchanges.coinbase_client' (/Users/silasmarkowicz/trading-ai-working/tests/../src/exchanges/coinbase_client.py)
___________________ ERROR collecting tests/test_scheduler.py ___________________
ImportError while importing test module '/Users/silasmarkowicz/trading-ai-working/tests/test_scheduler.py'.
Hint: make sure your test modules/packages have valid Python names.
Traceback:
../Library/Python/3.9/lib/python/site-packages/_pytest/python.py:498: in importtestmodule
    mod = import_path(
../Library/Python/3.9/lib/python/site-packages/_pytest/pathlib.py:587: in import_path
    importlib.import_module(module_name)
/Library/Developer/CommandLineTools/Library/Frameworks/Python3.framework/Versions/3.9/lib/python3.9/importlib/__init__.py:127: in import_module
    return _bootstrap._gcd_import(name[level:], package, level)
<frozen importlib._bootstrap>:1030: in _gcd_import
    ???
<frozen importlib._bootstrap>:1007: in _find_and_load
    ???
<frozen importlib._bootstrap>:986: in _find_and_load_unlocked
    ???
<frozen importlib._bootstrap>:680: in _load_unlocked
    ???
../Library/Python/3.9/lib/python/site-packages/_pytest/assertion/rewrite.py:186: in exec_module
    exec(co, module.__dict__)
tests/test_scheduler.py:10: in <module>
    from execution import scheduler
src/execution/scheduler.py:20: in <module>
    from .daily_retrain import daily_pipeline
src/execution/daily_retrain.py:18: in <module>
    from .data_ingestion.fetch_data import fetch_data
E   ModuleNotFoundError: No module named 'execution.data_ingestion'
__________________ ERROR collecting tests/test_trading_ai.py ___________________
ImportError while importing test module '/Users/silasmarkowicz/trading-ai-working/tests/test_trading_ai.py'.
Hint: make sure your test modules/packages have valid Python names.
Traceback:
../Library/Python/3.9/lib/python/site-packages/_pytest/python.py:498: in importtestmodule
    mod = import_path(
../Library/Python/3.9/lib/python/site-packages/_pytest/pathlib.py:587: in import_path
    importlib.import_module(module_name)
/Library/Developer/CommandLineTools/Library/Frameworks/Python3.framework/Versions/3.9/lib/python3.9/importlib/__init__.py:127: in import_module
    return _bootstrap._gcd_import(name[level:], package, level)
<frozen importlib._bootstrap>:1030: in _gcd_import
    ???
<frozen importlib._bootstrap>:1007: in _find_and_load
    ???
<frozen importlib._bootstrap>:986: in _find_and_load_unlocked
    ???
<frozen importlib._bootstrap>:680: in _load_unlocked
    ???
../Library/Python/3.9/lib/python/site-packages/_pytest/assertion/rewrite.py:186: in exec_module
    exec(co, module.__dict__)
tests/test_trading_ai.py:30: in <module>
    import data_ingestion.fetch_data as fetch_module
src/data_ingestion/fetch_data.py:12: in <module>
    from ..utils.logger import setup_logger
E   ImportError: attempted relative import beyond top-level package
______________ ERROR collecting tests/unit/test_var_calculator.py ______________
'parametric' not found in `markers` configuration option
=========================== short test summary info ============================
ERROR tests/test_advanced_strategies.py
ERROR tests/test_broker_integration.py
ERROR tests/test_exchanges.py
ERROR tests/test_scheduler.py
ERROR tests/test_trading_ai.py
ERROR tests/unit/test_var_calculator.py - Failed: 'parametric' not found in `markers` configuration option
!!!!!!!!!!!!!!!!!!! Interrupted: 6 errors during collection !!!!!!!!!!!!!!!!!!!!
============================== 6 errors in 6.43s ===============================
